{
  "schema_version": "classification-request-v2",
  "batch_id": "example_batch_001",
  "taxonomy_version": "1.0.0-draft.1",
  "taxonomy_profiles": [
    {
      "project_id": "vinwonders_vu_yen",
      "issues": [
        {
          "issue_id": "ACCESS_DENIED",
          "family_id": "SITE_ACCESS_CONGESTION",
          "name": "Không thể vào hoặc ra",
          "definition": "Phản ánh bị từ chối hoặc không thể đi qua điểm kiểm soát vào/ra; chưa kết luận việc từ chối là sai quy định.",
          "include_examples": [
            "Thẻ còn hạn nhưng bảo vệ không cho tôi vào công trường.",
            "Vé đã mua nhưng đến cổng bị từ chối vào."
          ],
          "exclude_examples": [
            "Cổng này chỉ dành cho nhân viên.",
            "Ai biết giờ mở cổng không?"
          ],
          "required_evidence": [
            "Có claim thực tế về bị từ chối hoặc không thể qua điểm kiểm soát."
          ],
          "priority": "P0"
        },
        {
          "issue_id": "ACCESS_SYSTEM_FAILURE",
          "family_id": "SITE_ACCESS_CONGESTION",
          "name": "Thiết bị hoặc hệ thống kiểm soát ra vào lỗi",
          "definition": "Phản ánh barrier, máy đọc thẻ, nhận diện khuôn mặt hoặc quét QR tại điểm kiểm soát không hoạt động đúng.",
          "include_examples": [
            "Máy nhận diện không nhận mặt, phải nhờ mở cổng.",
            "QR báo đã dùng dù tôi chưa vào lần nào."
          ],
          "exclude_examples": [
            "Bán máy quét QR.",
            "App thanh toán lỗi nhưng chưa có vấn đề tại cổng."
          ],
          "required_evidence": [
            "Nêu thiết bị/cơ chế kiểm soát và biểu hiện lỗi thực tế; không cần suy ra nguyên nhân kỹ thuật."
          ],
          "priority": "P0"
        },
        {
          "issue_id": "CHECKIN_BOTTLENECK",
          "family_id": "SITE_ACCESS_CONGESTION",
          "name": "Khâu kiểm tra vào/ra gây chậm",
          "definition": "Chậm trễ được gắn với kiểm tra thẻ, vé, QR, giấy tờ, đăng ký hoặc xử lý ngoại lệ tại điểm kiểm soát.",
          "include_examples": [
            "Kiểm tra giấy tờ từng người rất lâu, cả hàng đứng chờ.",
            "Soát vé chậm quá, một người xử lý cả hàng."
          ],
          "exclude_examples": [
            "Chờ ở cổng lâu nhưng không nói chậm ở khâu nào.",
            "Hướng dẫn chuẩn bị QR trước khi tới."
          ],
          "required_evidence": [
            "Có claim chậm trễ và bằng chứng liên hệ với một khâu kiểm tra vào/ra."
          ],
          "priority": "P0"
        },
        {
          "issue_id": "ENTRY_QUEUE",
          "family_id": "SITE_ACCESS_CONGESTION",
          "name": "Xếp hàng hoặc chờ chiều vào",
          "definition": "Phản ánh hàng chờ hoặc thời gian chờ đi vào địa điểm dự án.",
          "include_examples": [
            "Chờ 40 phút vẫn chưa được vào công trường.",
            "Hàng vào công viên kéo dài, đứng mãi chưa qua cổng."
          ],
          "exclude_examples": [
            "Kẹt cổng quá, không biết chiều nào.",
            "Xếp hàng mua đồ ăn bên trong."
          ],
          "required_evidence": [
            "Có claim chờ/xếp hàng và bằng chứng chiều vào từ target hoặc context được dẫn rõ."
          ],
          "priority": "P0"
        },
        {
          "issue_id": "EXIT_QUEUE",
          "family_id": "SITE_ACCESS_CONGESTION",
          "name": "Xếp hàng hoặc chờ chiều ra",
          "definition": "Phản ánh hàng chờ hoặc thời gian chờ rời địa điểm dự án qua cổng.",
          "include_examples": [
            "Tan ca mà chờ nửa tiếng chưa ra khỏi cổng.",
            "Ra khỏi công viên phải xếp hàng rất lâu."
          ],
          "exclude_examples": [
            "Kẹt ở cổng nhưng chưa rõ hướng.",
            "Vừa ra cổng thì gặp mưa."
          ],
          "required_evidence": [
            "Có claim chờ/xếp hàng và bằng chứng chiều ra; tan ca riêng lẻ không tự chứng minh ùn tắc."
          ],
          "priority": "P0"
        },
        {
          "issue_id": "GATE_CONGESTION_UNSPECIFIED",
          "family_id": "SITE_ACCESS_CONGESTION",
          "name": "Ùn tắc cổng chưa rõ chiều hoặc đối tượng",
          "definition": "Có phản ánh ùn/chờ tại cổng nhưng chưa đủ bằng chứng gán chiều vào/ra, người/xe hoặc nguyên nhân kiểm tra.",
          "include_examples": [
            "Kẹt ở cổng hơn nửa tiếng rồi.",
            "Cổng nghẽn quá, đứng mãi không nhúc nhích."
          ],
          "exclude_examples": [
            "Cổng đông vui, chụp ảnh rất đẹp.",
            "Đường phố kẹt xe, chưa liên hệ với dự án."
          ],
          "required_evidence": [
            "Có claim cản trở/chờ/ùn tại cổng và liên hệ nguồn/dự án đủ để xét; không chỉ từ đông."
          ],
          "priority": "P0"
        },
        {
          "issue_id": "VEHICLE_CONGESTION",
          "family_id": "SITE_ACCESS_CONGESTION",
          "name": "Ùn tắc luồng xe",
          "definition": "Xe ùn ứ, chắn lối hoặc di chuyển chậm tại cổng, lối tiếp cận hoặc bãi xe liên quan dự án.",
          "include_examples": [
            "Xe tải nối đuôi kín cổng công trường.",
            "Bãi xe công viên ùn, ô tô không ra được."
          ],
          "exclude_examples": [
            "Bãi xe có nhiều ô tô nhưng lưu thông bình thường.",
            "Bán xe tải giá tốt."
          ],
          "required_evidence": [
            "Xác định có xe và trở ngại lưu thông liên quan phạm vi dự án; không suy xe từ hình dung của model."
          ],
          "priority": "P0"
        },
        {
          "issue_id": "EXTERNAL_TRAFFIC_IMPACT",
          "family_id": "SITE_ACCESS_CONGESTION",
          "name": "Giao thông ngoài dự án ảnh hưởng tiếp cận",
          "definition": "Ùn tắc/sự cố đường bên ngoài được phản ánh làm khó việc đến hoặc rời dự án.",
          "include_examples": [
            "Đường dẫn vào công viên tắc, xe đứng hơn 30 phút."
          ],
          "exclude_examples": [
            "Hải Phòng hôm nay kẹt xe, chưa xác định liên quan dự án.",
            "Dự báo mai có thể đông."
          ],
          "required_evidence": [
            "Có claim ảnh hưởng tiếp cận và liên hệ đường/lối vào/ra dự án."
          ],
          "priority": "P0"
        },
        {
          "issue_id": "SERVICE_DELAY",
          "family_id": "CUSTOMER_COMPLAINT",
          "name": "Chậm phục vụ hoặc xử lý yêu cầu",
          "definition": "Phản ánh phải chờ hoặc yêu cầu được xử lý chậm ở dịch vụ ngoài khâu kiểm soát cổng.",
          "include_examples": [
            "Quầy hỗ trợ xử lý đổi vé quá lâu.",
            "Báo bộ phận hỗ trợ từ sáng mà chưa xử lý hồ sơ."
          ],
          "exclude_examples": [
            "Chờ soát vé ở cổng; dùng CHECKIN_BOTTLENECK khi có căn cứ.",
            "Thời gian xử lý theo hướng dẫn là hai ngày, chưa có phàn nàn."
          ],
          "required_evidence": [
            "Có claim chậm trễ phục vụ/xử lý; không tự suy delay từ một mốc thời gian."
          ],
          "priority": "P1"
        },
        {
          "issue_id": "NO_RESPONSE",
          "family_id": "CUSTOMER_COMPLAINT",
          "name": "Không phản hồi sau khi liên hệ",
          "definition": "Người viết phản ánh đã gọi, nhắn, gửi yêu cầu nhưng không nhận được phản hồi.",
          "include_examples": [
            "Nhắn hỗ trợ ba lần chưa ai trả lời."
          ],
          "exclude_examples": [
            "Cho hỏi số hotline.",
            "Tôi chưa gọi thử."
          ],
          "required_evidence": [
            "Có hành vi liên hệ và claim không được phản hồi; không đoán người viết đã liên hệ."
          ],
          "priority": "P1"
        },
        {
          "issue_id": "APP_SYSTEM_ISSUE",
          "family_id": "CUSTOMER_COMPLAINT",
          "name": "Lỗi ứng dụng hoặc dịch vụ số",
          "definition": "Phản ánh lỗi đăng nhập, mua vé, thanh toán, đăng ký hoặc chức năng số; khác lỗi thiết bị kiểm soát tại cổng.",
          "include_examples": [
            "App trừ tiền nhưng không hiện vé.",
            "Cổng đăng ký hồ sơ cứ báo lỗi không gửi được."
          ],
          "exclude_examples": [
            "Máy quét tại cổng không đọc QR; dùng ACCESS_SYSTEM_FAILURE.",
            "Hướng dẫn tải app."
          ],
          "required_evidence": [
            "Nêu chức năng/app và biểu hiện lỗi; không tự kết luận nguyên nhân hay trách nhiệm bên cung cấp."
          ],
          "priority": "P1"
        },
        {
          "issue_id": "STAFF_ATTITUDE",
          "family_id": "CUSTOMER_COMPLAINT",
          "name": "Phản ánh thái độ hoặc hành vi phục vụ",
          "definition": "Claim về cách giao tiếp/hành xử không phù hợp của nhân sự phục vụ hoặc kiểm soát.",
          "include_examples": [
            "Bảo vệ quát khách khi tôi hỏi lối vào."
          ],
          "exclude_examples": [
            "Cổng chậm nhưng không nói thái độ nhân viên.",
            "Nhân viên hôm nay rất nhiệt tình."
          ],
          "required_evidence": [
            "Có claim thái độ/hành vi; không suy thái độ từ việc từ chối vào đúng hay sai quy định."
          ],
          "priority": "P1"
        },
        {
          "issue_id": "UNRESOLVED_ISSUE",
          "family_id": "CUSTOMER_COMPLAINT",
          "name": "Vấn đề đã báo nhưng chưa được giải quyết",
          "definition": "Người viết đã phản ánh/yêu cầu xử lý, vấn đề vẫn còn hoặc tái diễn; khác chỉ chưa có câu trả lời.",
          "include_examples": [
            "Đã báo lỗi thẻ tuần trước, hôm nay vẫn không vào được."
          ],
          "exclude_examples": [
            "Thẻ vừa lỗi lần đầu.",
            "Đã được xử lý xong, cảm ơn."
          ],
          "required_evidence": [
            "Có claim đã báo/yêu cầu trước đó và hiện chưa giải quyết; cùng lúc có thể gán issue nguyên thủy."
          ],
          "priority": "P1"
        },
        {
          "issue_id": "REFUND_DISPUTE",
          "family_id": "CUSTOMER_COMPLAINT",
          "name": "Phản ánh hoàn tiền",